{
  "meta": {
    "schema_version": "1.0",
    "strategy": "d2p2t6",
    "account_id": "2",
    "account_label": "帳戶 #2 (D2P2T6)",
    "generated_at": "2026-05-16T22:05:00Z",
    "trading_date": "2026-05-16",
    "dry_run": false,
    "strategy_status": "active",
    "strategy_start_date": "2024-03-01",
    "previous_strategy": null,
    "accent_color": "#6366f1",
    "same_strategy_accounts": [
      { "id": "2", "label": "帳戶 #2 (D2P2T6)" }
    ]
  },
  "summary": {
    "nav": 100734.59,
    "cash": 1609.73,
    "initial_nav": 100000.00,
    "inception_date": "2024-03-01",
    "today_change": 320.10,
    "today_change_pct": 0.32,
    "total_return": 734.59,
    "total_return_pct": 0.73,
    "total_return_pct_twr": 0.73,
    "net_contribution": 0.0,
    "total_deposited": 0.0,
    "total_withdrawn": 0.0,
    "investment_gain": 734.59,
    "ytd_return_pct": 0.73,
    "monthly_return_pct": 0.20,
    "max_drawdown_pct": -5.20,
    "sharpe_ratio": null,
    "total_paused_days": 0,
    "is_paused": false,
    "paused_since": null
  },
  "portfolio": {
    "label": "D2P2T6 組合",
    "symbols": ["RTX", "LMT", "LLY", "JNJ", "NVDA", "MSFT", "AAPL", "AMZN", "GOOGL", "AVGO"],
    "rebalance_count": 0
  },
  "positions": [
    {
      "symbol": "RTX",
      "qty": 58.0,
      "avg_entry_price": 170.00,
      "current_price": 171.15,
      "market_value": 9926.70,
      "unrealized_pl": 66.70,
      "unrealized_plpc": 0.00676,
      "weight": 9.85,
      "in_portfolio": true
    },
    {
      "symbol": "LMT",
      "qty": 19.0,
      "avg_entry_price": 510.00,
      "current_price": 516.11,
      "market_value": 9806.09,
      "unrealized_pl": 116.09,
      "unrealized_plpc": 0.01199,
      "weight": 9.73,
      "in_portfolio": true
    }
  ],
  "nav_history": [
    { "date": "2024-03-01", "nav": 100000.00 },
    { "date": "2026-05-16", "nav": 100734.59 }
  ],
  "drawdown": {
    "dates":     ["2024-03-01", "2026-05-16"],
    "portfolio": [0.0, -1.2],
    "nasdaq":    [0.0, -2.0],
    "sp500":     [null, null]
  },
  "trade_log": [
    {
      "date": "2026-05-16",
      "nav": 100734.59,
      "trades_count": 0,
      "portfolio": ["RTX", "LMT", "LLY", "JNJ", "NVDA", "MSFT", "AAPL", "AMZN", "GOOGL", "AVGO"],
      "orders": []
    }
  ],
  "rankings": {
    "type": "universe_groups",
    "label": "三大宇宙即時排名",
    "groups": [
      {
        "id": "defense",
        "label": "🛡️ 軍火 TOP5",
        "items": [
          { "rank": 1, "symbol": "RTX", "price": 171.15, "change_pct": -2.56, "market_cap_b": 230.5, "in_portfolio": true },
          { "rank": 2, "symbol": "LMT", "price": 516.11, "change_pct": -0.85, "market_cap_b": 119.0, "in_portfolio": true },
          { "rank": 3, "symbol": "GD",  "price": 334.45, "change_pct": -1.80, "market_cap_b": 90.5,  "in_portfolio": false }
        ]
      },
      {
        "id": "pharma",
        "label": "💊 醫藥 TOP5",
        "items": [
          { "rank": 1, "symbol": "LLY", "price": 1003.52, "change_pct": -0.18, "market_cap_b": 896.1, "in_portfolio": true },
          { "rank": 2, "symbol": "JNJ", "price": 227.38,  "change_pct": -1.77, "market_cap_b": 545.7, "in_portfolio": true },
          { "rank": 3, "symbol": "MRK", "price": 111.35,  "change_pct": -1.79, "market_cap_b": 275.1, "in_portfolio": false }
        ]
      },
      {
        "id": "tech",
        "label": "💻 科技 TOP10",
        "items": [
          { "rank": 1, "symbol": "NVDA",  "price": 1050.40, "change_pct": 2.10,  "market_cap_b": 2580, "in_portfolio": true },
          { "rank": 2, "symbol": "MSFT",  "price": 415.20,  "change_pct": 0.80,  "market_cap_b": 3080, "in_portfolio": true },
          { "rank": 3, "symbol": "AAPL",  "price": 300.08,  "change_pct": -0.30, "market_cap_b": 2800, "in_portfolio": true },
          { "rank": 4, "symbol": "AMZN",  "price": 262.96,  "change_pct": -0.40, "market_cap_b": 2700, "in_portfolio": true },
          { "rank": 5, "symbol": "GOOGL", "price": 396.04,  "change_pct": 1.20,  "market_cap_b": 2400, "in_portfolio": true },
          { "rank": 6, "symbol": "AVGO",  "price": 424.71,  "change_pct": 0.90,  "market_cap_b": 850,  "in_portfolio": true },
          { "rank": 7, "symbol": "TSM",   "price": 188.50,  "change_pct": -0.60, "market_cap_b": 780,  "in_portfolio": false }
        ]
      }
    ]
  },
  "events": [],
  "email": {
    "subject": "[D2P2T6 #2] 2026-05-16 NAV $100,735 (+0.32%)",
    "preheader": "今日持倉 10 檔・交易 0 筆・總報酬 +0.7%",
    "dashboard_url": "https://itemhsu.github.io/tech-rebalance-dashboard/2/dashboard.html",
    "sections_rendered": ["header", "kpi", "portfolio_badges", "positions_table", "rankings", "trades", "cta", "footer"]
  }
}
